{
  "lukkSakId": "A1B2C3D4-E5F6-4789-ABCD-123456789BBB",
  "forsendelse": {
    "meldingsId": "2CB6929E-DE3F-49A4-8AE3-9625640DF0AA",
    "sendtTid": "2022-07-06T16:35:00+02:00",
    "avsender": {
      "organisasjon": {
        "organisasjonsnummer": "826726342",
        "navn": "Buskerud tingrett"
      },
      "person": {
        "etternavn": "Saksbehandler",
        "fornavn": "Litt",
        "tittel": "Saksbehandler"
      }
    },
    "mottaker": {
      "organisasjon": {
        "organisasjonsnummer": "983997953",
        "navn": "Innlandet politidistrikt"
      }
    }
  },
  "lukkeKategori": "TRUKKET",
  "beskrivelse": "Lukker denne saken da vi har motatt samtykke til at beslag gjennomf√∏res uten sak",
  "saksInformasjon": {
    "saksnummer": "22-025462ENE-TBUS/TDRA",
    "straffesaksnummer": "15434820",
    "kravId": "16972F79-0A35-4EC7-90A1-81E4EFAE1EAA"
  },
  "dokumenter": [
    {
      "internId": "16972F79-0A35-4EC7-90A1-81E4EFAE1EBB",
      "forsendelse": {
        "mimeType": "application/pdf",
        "sjekksum": "1a2eced0-5792-4431-ae5c-ba0942c7e7cc",
        "uri": "9c3eced0-5792-4431-ae5c-ba0942c7e7cc"
      },
      "overskrift": "Samtykke til beslag",
      "skrevetDato": "2025-12-10",
      "kategori": {
        "kode": "ANNET"
      }
    }
  ]
}
